smartctl 7.5 2025-04-30 r5714 [x86_64-w64-mingw32-w11-23H2] (AppVeyor)
Copyright (C) 2002-25, Bruce Allen, Christian Franke, www.smartmontools.org

=== START OF INFORMATION SECTION ===
Device Model:     TS128GSSD450K
Serial Number:    G559380155
LU WWN Device Id: 5 7c3548 1c292fcbb
Firmware Version: R0906A
User Capacity:    128,035,676,160 bytes [128 GB]
Sector Size:      512 bytes logical/physical
Rotation Rate:    Solid State Device
TRIM Command:     Available, deterministic, zeroed
Device is:        Not in smartctl database
ATA Version is:   ACS-2 (minor revision not indicated)
SATA Version is:  SATA 3.2, 6.0 Gb/s (current: 6.0 Gb/s)
Local Time is:    Fri Mar 13 10:10:50 2026 EDT
SMART support is: Available - device has SMART capability.
SMART support is: Enabled

=== START OF READ SMART DATA SECTION ===
SMART Status not supported: Incomplete response, ATA output registers missing
SMART overall-health self-assessment test result: PASSED
Warning: This result is based on an Attribute check.

General SMART Values:
Offline data collection status:  (0x00)	Offline data collection activity
					was never started.
					Auto Offline Data Collection: Disabled.
Self-test execution status:      (   0)	The previous self-test routine completed
					without error or no self-test has ever 
					been run.
Total time to complete Offline 
data collection: 		(    0) seconds.
Offline data collection
capabilities: 			 (0x71) SMART execute Offline immediate.
					No Auto Offline data collection support.
					Suspend Offline collection upon new
					command.
					No Offline surface scan supported.
					Self-test supported.
					Conveyance Self-test supported.
					Selective Self-test supported.
SMART capabilities:            (0x0003)	Saves SMART data before entering
					power-saving mode.
					Supports SMART auto save timer.
Error logging capability:        (0x01)	Error logging supported.
					General Purpose Logging supported.
Short self-test routine 
recommended polling time: 	 (   1) minutes.
Extended self-test routine
recommended polling time: 	 (   2) minutes.
Conveyance self-test routine
recommended polling time: 	 (   1) minutes.

SMART Attributes Data Structure revision number: 1
Vendor Specific SMART Attributes with Thresholds:
ID# ATTRIBUTE_NAME          FLAG     VALUE WORST THRESH TYPE      UPDATED  WHEN_FAILED RAW_VALUE
  1 Raw_Read_Error_Rate     0x0000   100   100   000    Old_age   Offline      -       0
  5 Reallocated_Sector_Ct   0x0000   100   100   000    Old_age   Offline      -       0
  9 Power_On_Hours          0x0000   100   100   000    Old_age   Offline      -       4880
 12 Power_Cycle_Count       0x0000   100   100   000    Old_age   Offline      -       385
148 Unknown_Attribute       0x0000   100   100   000    Old_age   Offline      -       1302007
149 Unknown_Attribute       0x0000   100   100   000    Old_age   Offline      -       17388
150 Unknown_Attribute       0x0000   100   100   000    Old_age   Offline      -       17216
151 Unknown_Attribute       0x0000   100   100   000    Old_age   Offline      -       17360
164 Unknown_Attribute       0x0000   100   100   000    Old_age   Offline      -       773387
165 Unknown_Attribute       0x0000   100   100   000    Old_age   Offline      -       594
166 Unknown_Attribute       0x0000   100   100   000    Old_age   Offline      -       494
167 Unknown_Attribute       0x0000   100   100   000    Old_age   Offline      -       560
159 Unknown_Attribute       0x0000   100   100   000    Old_age   Offline      -       0
160 Unknown_Attribute       0x0000   100   100   000    Old_age   Offline      -       0
161 Unknown_Attribute       0x0000   100   100   000    Old_age   Offline      -       97
163 Unknown_Attribute       0x0000   100   100   000    Old_age   Offline      -       19
168 Unknown_Attribute       0x0000   100   100   000    Old_age   Offline      -       1000
169 Unknown_Attribute       0x0000   100   100   000    Old_age   Offline      -       44
177 Wear_Leveling_Count     0x0000   100   100   050    Old_age   Offline      -       3662
181 Program_Fail_Cnt_Total  0x0000   100   100   000    Old_age   Offline      -       0
182 Erase_Fail_Count_Total  0x0000   100   100   000    Old_age   Offline      -       0
192 Power-Off_Retract_Count 0x0000   100   100   000    Old_age   Offline      -       194
194 Temperature_Celsius     0x0000   100   100   000    Old_age   Offline      -       38
195 Hardware_ECC_Recovered  0x0000   100   100   000    Old_age   Offline      -       0
196 Reallocated_Event_Count 0x0000   100   100   016    Old_age   Offline      -       0
199 UDMA_CRC_Error_Count    0x0000   100   100   050    Old_age   Offline      -       0
232 Available_Reservd_Space 0x0000   100   100   000    Old_age   Offline      -       100
241 Total_LBAs_Written      0x0000   100   100   000    Old_age   Offline      -       910563
242 Total_LBAs_Read         0x0000   100   100   000    Old_age   Offline      -       723798
245 Unknown_Attribute       0x0000   100   100   000    Old_age   Offline      -       1546774

SMART Error Log Version: 1
No Errors Logged

SMART Self-test log structure revision number 0
Warning: ATA Specification requires self-test log structure revision number = 1
No self-tests have been logged.  [To run self-tests, use: smartctl -t]

SMART Selective self-test log data structure revision number 1
 SPAN  MIN_LBA  MAX_LBA  CURRENT_TEST_STATUS
    1        0        0  Not_testing
    2        0        0  Not_testing
    3        0        0  Not_testing
    4        0        0  Not_testing
    5        0        0  Not_testing
    6        0    65535  Read_scanning was never started
Selective self-test flags (0x0):
  After scanning selected spans, do NOT read-scan remainder of disk.
If Selective self-test is pending on power-up, resume after 0 minute delay.

The above only provides legacy SMART information - try 'smartctl -x' for more

